{
  "opendb_id": "d5ff7ec3-4b2e-42a5-a0b2-155034f8b3c3",
  "cores": {
    "total": 32,
    "performance": 32,
    "efficiency": 0,
    "threads": 64
  },
  "clocks": {
    "performance": {
      "base": 4000,
      "boost": 5300
    },
    "efficiency": {
      "base": null,
      "boost": null
    }
  },
  "cache": {
    "l1": null,
    "l2": null,
    "l3": 128
  },
  "specifications": {
    "integratedGraphics": {
      "model": "None",
      "baseClock": 0,
      "boostClock": 0,
      "shaderCount": 0
    },
    "memory": {
      "maxSupport": 192,
      "types": [
        "DDR5"
      ],
      "channels": 4
    },
    "tdp": 350,
    "eccSupport": false,
    "includesCooler": false,
    "packaging": null,
    "lithography": "5 nm",
    "simultaneousMultithreading": true
  },
  "metadata": {
    "name": "AMD Ryzen Threadripper 7970X",
    "part_numbers": [],
    "releaseYear": 2023
  },
  "series": "Ryzen Threadripper",
  "microarchitecture": "Zen 4",
  "coreFamily": null,
  "socket": "sTR5",
  "general_product_information": {
    "amazon_sku": "B0CK2W3WFP",
    "newegg_sku": "19-113-806",
    "walmart_sku": 5177043337
  }
}