{
  "opendb_id": "6ca6759f-470e-4279-999b-8101f511d32f",
  "cores": {
    "total": 4,
    "performance": 4,
    "threads": 4
  },
  "clocks": {
    "performance": {
      "base": 3.7,
      "boost": 4
    }
  },
  "cache": {
    "l2": 4,
    "l3": 0
  },
  "specifications": {
    "integratedGraphics": {
      "model": "AMD Radeon R7 (on-die)"
    },
    "memory": {
      "maxSupport": 0,
      "types": []
    },
    "tdp": 95,
    "eccSupport": false,
    "includesCooler": false,
    "packaging": "OEM/Tray",
    "lithography": "28 nm",
    "simultaneousMultithreading": false
  },
  "metadata": {
    "name": "AMD A10 Pro 7850B 3.7 GHz 4-Core FM2+",
    "manufacturer": "AMD",
    "part_numbers": [
      "AD785BXBI44JA"
    ],
    "series": "AMD A10"
  },
  "series": "AMD A10",
  "microarchitecture": "Steamroller",
  "coreFamily": "Kaveri",
  "socket": "FM2+",
  "general_product_information": {
    "amazon_sku": "B0179AA7AG"
  }
}