{
  "opendb_id": "b3e855a0-64fe-48fc-88fb-0898e4deb440",
  "cores": {
    "total": 18,
    "performance": 18,
    "threads": 36
  },
  "clocks": {
    "performance": {
      "base": 2.3,
      "boost": 3.6
    }
  },
  "cache": {
    "l2": 5,
    "l3": 45
  },
  "specifications": {
    "integratedGraphics": {
      "model": "None"
    },
    "memory": {
      "maxSupport": 1536,
      "types": []
    },
    "tdp": 145,
    "eccSupport": true,
    "includesCooler": false,
    "packaging": "Boxed",
    "lithography": "14 nm",
    "simultaneousMultithreading": true
  },
  "metadata": {
    "name": "Intel Xeon E5 2697 V4 2.3 GHz 18-Core LGA2011-3",
    "manufacturer": "Intel",
    "part_numbers": [
      "BX80660E52697V4"
    ],
    "series": "Intel Xeon E5"
  },
  "series": "Intel Xeon E5",
  "microarchitecture": "Broadwell",
  "coreFamily": "Broadwell-EP",
  "socket": "LGA2011-3",
  "general_product_information": {
    "amazon_sku": "B08YLTM24Z"
  }
}