{
  "opendb_id": "65d71712-5992-4183-8801-83ea0853e677",
  "cores": {
    "total": 4,
    "performance": 4,
    "threads": 4
  },
  "clocks": {
    "performance": {
      "base": 3.8,
      "boost": 4.2
    }
  },
  "cache": {
    "l2": 1,
    "l3": 6
  },
  "specifications": {
    "integratedGraphics": {
      "model": "Intel HD Graphics 630"
    },
    "memory": {
      "maxSupport": 64,
      "types": []
    },
    "tdp": 91,
    "eccSupport": false,
    "includesCooler": false,
    "packaging": "OEM/Tray",
    "lithography": "14 nm",
    "simultaneousMultithreading": false
  },
  "metadata": {
    "name": "Intel Core i5 7600K 3.8 GHz 4-Core LGA1151 OEM/Tray",
    "manufacturer": "Intel",
    "part_numbers": [
      "CM8067702868219"
    ],
    "series": "Intel Core i5"
  },
  "series": "Intel Core i5",
  "microarchitecture": "Kaby Lake",
  "coreFamily": "Kaby Lake-S",
  "socket": "LGA1151",
  "general_product_information": {}
}