{
  "opendb_id": "d63c7fcb-36f6-422e-b796-e938b3096d55",
  "cores": {
    "total": 16,
    "performance": 16,
    "threads": 32
  },
  "clocks": {
    "performance": {
      "base": 2.3,
      "boost": 3.6
    }
  },
  "cache": {
    "l2": 4,
    "l3": 40
  },
  "specifications": {
    "integratedGraphics": {
      "model": "None"
    },
    "memory": {
      "maxSupport": 0,
      "types": []
    },
    "tdp": 135,
    "eccSupport": true,
    "includesCooler": false,
    "packaging": "OEM/Tray",
    "lithography": "22 nm",
    "simultaneousMultithreading": true
  },
  "metadata": {
    "name": "Intel Xeon E5 2698 V3 2.3 GHz 16-Core LGA2011-3 OEM/Tray",
    "manufacturer": "Intel",
    "part_numbers": [
      "CM8064401609800"
    ],
    "series": "Intel Xeon E5"
  },
  "series": "Intel Xeon E5",
  "microarchitecture": "Haswell",
  "coreFamily": "Haswell-EP",
  "socket": "LGA2011-3",
  "general_product_information": {
    "amazon_sku": "B08MLNFJSD"
  }
}